"오뚜기 진라면은 라면 시장 2위 브랜드다.농심의 ‘30 년 아 성’ 을 위협하는 오뚜기의 비밀 병기는 ‘ 소 셜 임팩트’. 오뚜기는 지난해에 이어 올해도 라면 부문에서 ‘ 가장 신뢰하는 브랜드’ 1위에 올랐다.지난해 말 기준 시장 점유율( 판매 량 기준) 14.6% 로 농심 신라면 (15.5%) 을 턱밑까지 추격 중이다.한국경제신문은 지난 7월, 10월 두 차례에 걸쳐 남녀 1만 명을 대상으로 온라인 설문조사 형태로 ‘2020 한 경- 입소스- 피 앰 아이 기업 소 셜 임팩트 조사 (CSIS) ’를 시행했다.그 결과 50개 업종에서 브랜드별 사회적 평판의 명암이 여실히 드러났다."
다 주택자에 대한 세 부담을 강화한 ‘7 ·10 대책’ 이후 양 평의 전원주택 매물이 빠르게 쌓이고 있어서 다. 이날 중개업소를 찾은 서울 아파트 소유 집주인은 2018년 준공된 2 층짜리 양 평 전원주택을 건축 비인 4억 3000만원만 받고 팔겠다고전 남 무안군 삼 향 읍 ‘ 경남아 너스 빌’ 전용 84㎡ 는 3월 2억 6500만원에 실거래된 뒤 지난 12일 4500만원 하락한 2억 2000만원에 거래를 마쳤다.세컨드하우스 수요가 사라진 휴양지 아파트 값도 하락세다.양평군 강 상면 Y 공인 관계자는 “ 별 장처럼 쓰려고 큰 돈을 들이지 않고 전원주택을 샀다가 2 주택자가 된 집주인들이 연내 처분을 위해 급매물을 쏟아 내고 있다 ”며 “ 지역 경제가 파탄 날 지경” 이라고 하소연했다.입주율은 집들이 기간에 실제 입주한 가구 비율을 뜻한다.
"코로나 19 유행 장기화를 대비해 경제 피해를 최소화하면서도 방역 효과의 연속성을 더하겠다는 것이 이번 개편의 핵심이다.정부는 시설운영 중단 등은 최대한 지양하면서 국민들의 자율적인 방역 참여를 이끄는데 초점을 두겠다고그 동안 집단 감염이 발생한 시설 등에서 올바른 마스크 착용 자는 감염되지 않은 사례 등이 나오면서 이를 착안했다는 게 당국의 설명이다.손 영래 중앙사고 수습본부 전략기획 반장( 보건복지 부 대변인) 은 지난 13일 백 브리핑에서 "" 정부가 강압적으로 특정시설 강제 폐쇄 혹은 운영 중단 등 극단적 조치를 하는 것은 사회적 수용 도가 떨어진다 ""며 "" 자율적으로 국민이 따라 올 수 있고 책임을 갖고 자체적으로 방역 수칙을 지킬 수 있도록 하는 것을 고민하고 있다"" 고 밝혔다.""( 서울= 뉴스 1) 이 영성 기자, 이형 진 기자 = 정부가 11월 1일 사회적 거리두 기 3 단계 체계를 전면 개편하고, 이 날 발표한다."
일부는 레이더 망에 걸리지 않도록 위치 추적 장치를 끄고 갈라 파고 스 영해를 침범했다.미국 무선 주파수 데이터 분석업체 ‘ 호크아이 360’ 은 중국 선박이 AIS( 선박 자동식별 장치 )를 끄고 영해로 들어가 위성 탐지 및 추적을 피하고 있다고호크아이 360 관계자는 “ 갈라 파고 스 영해에서 AIS 정보와 일치하지 않는 무선 주파수를 여럿 확인했다.특히 대형 급 유선을 동원해 추가 급유를 하며 조업기간을 늘리는 방식으로 장기간 싹쓸이 조업을 하는 탓에 어장이 붕괴되고 있다.일본 히로 시마 대학교 해양 생물학자 구스타보 산 체스는 가 디 언과의 인터뷰에서 “ 동 태평양 전역의 해양 생태계에 악영향을 미칠 수 있다” 고 우려했다.
"최 씨가 사업 초기 가내 수공업으로 김치를 만들어 팔 던 포틀랜드 파 머스 마켓도 인스타 그램 추모 글에서 "" 그는 유쾌하고 넓은 마음과 식품 생산에 폭넓은 지식을 지닌 사람이었다"" 고 기렸다."" 지난달 31일( 현지시간) 오리 건주( 州) 포틀랜드 경찰과 현지언론에 따르면 포틀랜드에서 최가 네 김치 (Chois Kimchi) 라는 업체를 운영해 온 매 슈 최 (33) 씨가 지난달 25일 새벽 집에 침입한 괴한 희 흉기에 부상해 사망했다."" 범인은 붙잡히지 않았으며 경찰은 흑인 남성 한 명을 용의자로 쫓고 있다."" 최 씨는 오리건대 에서 경영학과 스포츠 경영학을 전공한 뒤 2011년 어머니와 함께 최가 네 김치를 창업했다."" 그는 자신의 성을 따서 만든 이 브랜드로 포틀랜드를 비롯한 여러 지역에 김치를 알리는 데 성공했다."
"서울= 뉴 시스 박 준호 기자 = 나 경원 전 국민의 힘 의원은 1일 "" 혼탁한 시국에 제 아들은 곧 군 입대를 한다 ""며 "" 대한민국 국민으로서 당연히 이행해야 할 의무라지만, 그래도 아들의 입대 날짜가 다가올수록 마음이 무거워 지는 것은 어쩔 수 없다"" 고 밝혔다.나 전 의원은 "" 요즘 세상을 보면 숨 쉬고 살기도 힘든 세상이 되어가는 듯하다 ""며 "" 사법 부와 의회는 물론, 언론과 시민단체 권력까지 모두 움켜쥔 권력이 검찰까지 확실히 틀어쥐려고 악을 쓴다 ""며 현 정권을 비판했다.앞서 서민 교수는 지난해 조국 전 장관이 이중 국적을 가진 아들이 내년에 군 입대할 예정이라고 언급한 기사를 전달하면서 "" 남은 두 달 간 입대를 안 시키면 이게 또 허위사실 유포가 되 버리네요?거짓말을 질색하는 분인 만큼 남은 기간 어떻게든 군대를 보내든지 아니면 조국님이 자기 스스로를 고소하는 수밖에 없겠네요나 전 의원은 "" 조국 전 장관에게 보내는 서민 교수의 페이스 북 글을 보니 불현듯 작년 제 아들을 둘러싼 원정 출산 공격이 떠오른다 ""며 ""1 년이 조금 넘어 서민 교수의 글을 보니 이 역시도 물타기용 의혹 제기였나"
"A 씨는 사업이 어려워지자 노란 소득 공제를 중도 해지하기로 했다.금융회사는 소득 세법에 따라 금융 관련 세금을 원 청 징수할 의무가 있기 때문에 B 씨가 소득 또는 세액 공제를 받지 않았다는 증빙이 없는 경우 기타 소득세를 환급해 줄 수 없기 때문이다.갑 자기 급전이 필요 해진 C 씨는 연금 저축보험을 중도 해지했는데 저축성 보험인 줄 알고 가입한 해당 상품의 해지 환급금이 179만 8248원에 그쳐 어리둥절했다.애당초 해당 상품의 환급률이 89.7%에 불과 해 해지 환급금이 215만 3590원이었고, 여기에 기타 소득세를 35만 5342원 더 떼고 나니 C 씨 입장에선 총 60만 1752만원이 체감 손실된 것이었다."" 연금 저축· 개인 형 퇴직연금 (IRP)· 노란 우산 공제는 이른바 3대 절세 금융상품으로 불리며 저금리 시대에서 중요한 노후 대비 자산관리 수단으로 자리매김했습니다."
"청원인은 "" 정치인 총장이 검찰을 정치로 덮어 망치고 있다"" 라며 "" 반성하고 자숙해도 모자랄 정치 검찰이 이제는 아예 대놓고 정치를 하기 시작한다"" 고 주장했다."" 커 밍 아웃 검사는 추 장관이 자신의 수사 지휘권 행사 등을 비판한 이환 우 (43· 사법 연수원 39 기) 제주 지검 검사를 비판하며 쓰인 표현이다."" 앞서 이 검사는 검찰 내부 망 이프로스에 올린 글에서 추 장관을 겨냥, "" 그 목적과 속내를 감추지 않은 채 인사권, 지휘권, 감찰권이 남발되고 있다고느끼고 있다"" 고 했다.이에 추 장관은 자신의 사회관계 망서비스 (SNS )에 이 검사를 두고 "" 좋습니다."
A 씨와 함께 잼을 제조한 B 씨에게도 징역 1년 6개월과 벌금 7억 5000만원을 선고하고 2년 간 형의 집행을 유예했다.이 데일리 박 한나 기자 한 번 맛보면 끊을 수 없다는 뜻에서 ‘ 악 마의 잼’ 이라고 칭송 받던 제주의 한 수제 과일 잼. 이 잼은 사회관계 망서비스 (SNS) 와 방송을 통해 유명세를 타 불티나게 팔렸다.1만원 대에 판매하는 잼을 통해 업체는 한해 수익만 7억원 (2018 년) 을 올렸을 정도다.아울러 A 씨에게 1년 간의 보호 관찰 및 200 시간의 사회봉사도 명령했다.그러자 제주 시내 주택가 단독주택에 허가를 받지 않고 잼 가공 시설을 만든 후 미등록 잼을 제조했다.
"서울= 뉴 시스 안 채원 기자 = 정 세균 국무총리는 1일 사회적거리두 기를 기존 3 단계에서 5 단계로 세분화하는 내용의 사회적 거리두 기 개편 방안을 발표했다.정 총리는 이날 오후 정부 서울 청사에서 주재한 신종 코로나 바 이러스 감염증( 코로나 19) 중앙 재난안전대책본부( 중 대본) 모두 발언에서 "" 위드 코로나 (with Corona) 시대에 맞는 사회적 거리두 기 개편 방안을 확정하고자 한다 ""며 이같이 말했다.정 총리는 "" 이번 개편의 목표는 지속가능한 방역체계의 안착이며, 키워드는 정밀 방역"" 이라며 "" 코로나 19와 싸워 온 지난 9개월 간의 경험을 토대로 전문가 의견 수렴, 부처 및 지자체와의 협의, 중 대본 토론 등 약 한 달 간의 논의 과정을 거쳤다"" 고 소개했다.정 총리는 우선 "" 거리두 기 단계는 세 단계에서 다섯 단계로 현실에 맞게 세분화된다 ""며 "" 기존의 각 단계별 방역 강도 차이가 너무 커서 단계 조정 시 사회적 수용성이 떨어지는 단점을 보완하기 위함"" 이라고 전했다.이어 정 총리는 "" 일률적인 집합금지 또는 집합제한 명령 등 시설 별· 상황별 여건을 제대로 고려하지 못했던 방역조치 또한 맞춤형으로 재설계함으로써 현장의 방역 수칙 준수율을 높여 방역 효과를 제고하고자 한다"" 고 설명했다."
"하지만 국내외 연구 결과를 종합하면, 마스크를 써서 뇌 손상이 생길 정도로 산소가 부족 해진다는 근거는 없습니다.다만, 그 ` 장시간이라는 게 어느 정도를 의미하는 지에 대해선 연구마다 달라 기준점으로 삼을 만한 것은 없습니다."" 식 약 처 관계자는 "" 마스크 사용자와 환경에 따라 다 다를 수밖에 없기 때문에 사용시간을 특정할 수 없고 실제로 제품에서 특정하지도 않는다."" 면서 "" 대신 마스크가 땀에 젖는 등 숨쉬기 불편한 상황일 때는 잠깐 벗고 쉴 것을 권장하고 있다.■ 마스크 내 화학물질이 후유증· 폐암 유발 → 근거 없음 위 글 2, 3번에 해당하는 내용입니다."
"A 씨는 1억원의 연봉을, B 씨는 연 4000만원을 총 금 여액으로 받는다.그럼에도 신용카드 공제를 받지 못하는 경우는 크게 두 가지로 나뉜다.여기에 신용카드 등 소득 공제금액으로 줄어드는 세액( 결정 세액 감소) 을 2019년 귀속 근로소득지급 명세서의 공제금액을 활용해 미리 계산할 수 있도록 했다.연말 정산을 통해 B 씨는 330만원의 소득 공제를 받았지만 A 씨의 소득 공제액은 0원 이었다.정부는 지난달 30일 국세청 연말 정산 미리 보기 서비스를 실시하고 1~9 월까지 신용카드 등 사용 내역에 대한 정보를 제공한다."
"주유 소 2 곳에서 기름을 넣은 차량의 피해 건수는 70 여건이다.경찰은 “ 가짜 경유를 누가 만들었는지, 어떻게 만들었는지는 주유소 업주 등을 불러 조사를 해봐야 알 수 있다 ”며 “ 현재 가짜 경유 성분을 구체적으로 밝히기는 곤란 하다” 고 했다.경찰은 “ 주유 소 2 곳은 업주 한 명이 운영하는 것으로 알고 있으며 현재 잠적한 상태 ”라고 설명했다.한 운전자는 “ 지난 24 일 계룡산을 갔다가 오는 도중 A 주유소에서 기름을 넣었는데 액 셀러 레이터를 밟으면 꿀렁 거리다 멈췄다 ”며 “ 서비스센터에 갔더니 수리비용 만도 700만원 정도 든다는 말을 들었다” 고 주장했다."" 가짜 석유 만들어 팔면 5년 이하 징역"" , 경찰은 주유소 업주, 경유를 공급하는 탱크로리 운전자와 차량, 사업장 대표 등을 상대로 수사 중이다."
"대법원 판결은 이제야 나왔지만, 사실 이명 박 씨를 둘러싼 여러 의혹이 나온 건 13년도 더 됐습니다.바로 2007년 한나라 당 대선 후보 경선 때 이명 박, 박근 혜 당시 후보들 끼리폭로 전을 벌이면 서였는데요. 이때 두 후보가 서로 폭로 했던 내용들이 지금 모두 재판에서 사실로 확인되고 있습니다.2007년 한나라 당 대선 후보 경선. 이명 박/ 한나라 당 대선 경선 후보 (2007 년 8월) : 제가 지나온 삶에 누가 돌을 던질 수가 있겠습니까.상대적으로 열세이던 박근 혜 후보는 집요하게 이 후보의 재산형성 과정에 대해 캐물었습니다."
"농식품 부 관계자는 "" 기존 직 불제를 새 제도로 교체하는 과정에서 정책 홍보가 이뤄 진 결과, 새로 농가 경영체 등록을 한 영향도 있을 것"" 이라고 말했다.그러나 농민 급증의 진짜 배경은 전국으로 퍼져 나간 농민소득 때문이라는 분석에 무게가 더 실린다.광주광역시에 거주하는 일용직 노동자 A 씨는 "" 실제 사는 곳은 광주 지만 농민 수당을 타내기 위해 고향 마을로 주민등록을 옮기고 농업인으로 등록했다 ""며 "" 가족이 보유한 땅을 쪼개면 현금을 주니 못 받으면 바보라는 인식이 팽배하다"" 고 말했다."" 올해 농민 수가 급증한 것을 두고 농림 축산식품 부는 공익 형 직 불제 홍보의 영향이라는 입장이다.농식품 부의 공익 형 직 불제에 비해 신청 조건이 까다롭지 않아 추가 소득을 기대하고 신청한 농민 수만 전 남, 전 북에서 각각 24만명, 10만명이 넘는다."
"세종= 뉴 시스 위 용성 기자 = 정 부가 농축산물 소비 촉진을 위해 이달 중 한우· 한 돈, 김장 재료 등의 할인 행사를 대대적으로 추진한다."" 농림 축산식품 부는 오는 11일 농업 인의 날을 맞아 총 15개의 할인 행사를 진행할 계획이라고 1일 밝혔다.품목별 자 조금 단체, 농협· 대형 유통업체, 온라인 쇼핑몰, 직거래 매장 등이 참여한 가운데 인기 품목들을 중심으로 최대 50%까지 할인 판매가 이뤄 진다."" "" 먼저 한우를 시중보다 40~50% 싸게 살 수 있는 직거래 장터를 8일부터 10일까지 개최하고 우리한 우 판매점에서 연말까지 사용 가능한 한우 사랑 상품권을 20% 할인해 공급한다."" 돼지고기 할인 행사도 함께 진행된다."
병을 일으키는 심장 특정 부위에 방사선을 쬐는 것인데 움직이지 않는 암세포와 달리 움직이는 심장의 정확한 부위에 방사선을 조사하는 것은 최첨단 기술이 필요합니다.기자 심장이 고르지 않게 빨리 뛰는 병을 30년 넘게 앓아 온 김 규환 씨. 부정맥 치료를 위한 약물 투여와 수술도 수차례 받았고 인공 박동기까지 몸 안에 심었지만 때때로 심정지 증세는 계속됐습니다.김 규환 (85 세)/ 심장 부정맥 환자 : 심장이 너무 빨리 뛰어서 응급실에 실려오고 그랬어요.차 명진/ 서울대병원 순환기 내과 교수 : ( 심장) 수술을 여러 번 받았기 때문에 카테터 수술이나 다른 수술적 치료가 불가능한 ( 상태입니다.)미국 연구에서는 말기 심장병 환자의 52% 가 방사선 치료를 거쳐 2년 넘게 생존한 것으로 나타났습니다.
"호미로 파낸 흙은 쓰레받기로 퍼 올려 고무 양동이에 담아내는데 파 올린 흙이 다시 산처럼 쌓였다.발굴단은 아쉬운 마음만 담기고 흙을 다시 덮어야 했다.앞서 4일 간의 발굴 휴식 기간 동안 노출된 유골들이 햇빛에 노출되는 것을 막기 위해 덮어두었던 천막을 걷어내자 지난 발굴과정에서 발견된 유골들이 드러났다.겹겹이 쌓인 뼈들은 이곳이 집단적인 학살 현장이었음을 방증했다."" 발굴작업을 맡은 한국전쟁 기 민간인 학살 유해 발굴 공동 조사단 단원들은 묵묵히 70년 간 쌓여 온 세월을 훑어 내려갔다."
기성세대의 꼰대질에 스트레스를 받으며 ‘ 절대 저렇게 되지 말자’ 고 다짐했던우리 땐 휴가 5일은 생각도 못했는데…. 그냥 이렇게 꼰대가 되어 가는가 싶다” 고 말했다.90년 대생들에게 이른바 ‘ 젊 꼰( 젊은 꼰대)’ 은 ‘ 늙꼰( 늙은 꼰대) ’보다 더 공포스러운 존재다.중견기업에 다니는 정모 (28) 씨도 “ 부장 이상은 우리와 세대가 완전 다르니까 아빠뻘이라고 생각하면 잔소리를 해도 이해 해보려는 마음이 그나마 생긴다 ”며 “ 고작 나보다 대여섯 살 많은 ‘ 젊 꼰’ 들이 부장 기분 살피면서 ‘ 회식 빠지지 말자’ ‘ 출근 정시보다 일찍 하자’ 난리 치는 건 이해가 안 된다” 고 말했다.30대 선배가 다음 날 불러 ‘○○ 씨. 나는 괜찮지만 윗분들이 얼마나 예의 없게 보시겠어.
""" 정부가 오늘 (1 일) 사회적 거리두 기 3 단계 체계를 전면 개편할 예정이다.신종 코로나 바 이러스 감염증( 코로나 19) 유행 장기화를 대비해 경제 피해를 최소화하고 방역 효과의 연속성을 더하겠다는 판단에서 다."" 이날 오후 중앙 재난안전대책본부( 방 대본) 는 기존 3 단계 체제를 더욱 세분화하는 개편안을 공식 발표한다.현재 거리두 기 체계는 1~3 단계 간 방역 강도 차이가 큰 편이다.이에 시설 운영 중단 혹은 폐쇄 등 극단적 조치가 이뤄 져 경제· 사회적 피해가 커지거나, 확산 세에 비해 방역 강도가 약하다는 지적이 제기돼 왔다.이 같은 이유로 정부도 1.5 단계, 2.5 단계 등 체계를 적용하며 유동성을 보였다."
"국정 농단 수사를 주도한 윤 총장이 보수 야권 몰락에 원인을 제공했다는 구원도 여전하다.여권 투 톱에 이은 전체 3 위지만, 다른 보수 야권 주자들 과의 격차는 상당하다."" 윤석 열 대망론과 맞서기 위한 기존 보수 야권의 잠룡들의 발걸음도 빨라 지고 있다.홍 준 표 무소속 의원 (6.8%), 안 철수 국민의 당 대표 (5.8%), 오 세 훈 전 서울시장 (3.1%), 유 승 민 전 의원 (3.0%), 황 교 안 전 미래 통합당( 현 국민의 힘) 대표 (2.5%) 등은 모두 한 자릿수에 머물렀다.유 승 민 계가 생활정치 공간을 목표로 개설한 정치 카페 HOW’s( 하우스) 역시 일각에선 대선 준비 공간이라 보고 있다."
"플라스틱 필름으로 포장된 즉석 밥이나 만두 제품은 밀봉된 상태로 조리할 경우 제품이 터질 수 있으므로 뚜껑이나 포장을 일부 개봉한 후 조리해야 한다.참치 나 장조림, 과일 통조림 등 금속 캔에 담긴 식품이 남았을 땐 밀폐용기에 옮겨 담아 냉장 보관해야 한다.특히 과일의 갈 변( 갈색으로 변함) 을 막기 위해 내부가 주석으로 코팅된 과일 통조림의 경우 개봉한 상태로 두면 코팅이 산소와 반응해 주석 성분이 녹아 나올 수 있다.식 약 처는 "" 식품용 기구 및 용기· 포장에서 식품으로 새 어 나올 수 있는 물질에 대해 계속해서 조사하고 올바른 사용 정보를 제공할 계획"" 이라고 밝혔다.은박 뚜껑을 완전히 제거하지 않으면 전자 레인지의 마이크로 파가 은박 성분을 투과하지 못해 화재로 이어질 수 있다."
북촌 일대 상인들은 정부의 1차 소 상공인 대출 때 받은 1000만원이 바닥 난 지 오래다.이에 관광객보다 직장인을 주고객층으로 바꾸는 식당도 늘고 있다.실제로 10여년 간 관광객을 대상으로 프리미엄 수제 한국 라면 점을 운영했던이모 씨 (73) 는 최근 설렁탕 집으로 간판을 바꿨다.인근 중개업소에서도 술집이나 옷가게보다는 국 밥집· 수제비 집 등 직장인을 대상으로 한 일반 음식점 개업을 추천했다.
"부검이 지체돼 장례가 3일이나 미뤄 진 걸 두고 선 "" 사망 시각이 금요일 새벽이라 어쩔 수가 없었다"" 고 해명했다.대구에 사는 A(50) 씨는 지난달 어머니 B(90) 씨를 하늘로 떠나보냈다.유족들은 경찰 요구를 받아들이기로 했다.하지만 이후 경찰의 대응은 미흡하기 그지 없었다.부검 명령이 3일 뒤에야 떨어진 탓에 유족들은 이 기간 동안 어머니 시신을 병원 안치실에 모셔야 했다."
"대신 코로나 19를 최대한 억제하기 위해 거리두 기 1 단계에서부터 23 종의 다중이용시설에 대해 마스크 착용 등 핵심 방역 수칙을 의무화한다.방역 수칙 위반 시 운영자· 관리자에게는 300만원 이하, 이용자에게는 10만원 이하의 과태료가 부과된다.각 시설· 활동에 대한 획일적인 조치 대신 위험도 변화에 따라 단계적으로 운영시간이나 이용인원을 제한하기로 했다.지금의 환자 발생 추세라면 7일 이후 전국적으로 1 단계가 적용될 것으로 보인다."" 기존에는 2 주간 일 평균 국내 발생 확 진자 수가 50명 미만일 때 1 단계였고, 50∼100 명은 2 단계, 100∼200 명 이상이 3 단계였다."
"추 장관이 지난달 29일 자신의 사회관계 망서비스 (SNS )에 이환 우 제주 지검 검사 관련 기사를 공유하며 “ 좋습니다.같은 날 최 재만 춘천 지검 검사는 검찰 내부통신망에 ‘ 장관님의 SNS 게시 글에 대하여’ 라는 글을 올려 “ 나도 커 밍 아웃하겠다 ”라고 밝혔다.성소 수자차별 반대 무지개행동은 지난달 30 일 추 장관과 검사들의 커 밍 아웃 표현 사용에 대해 “ 커 밍 아웃이 갖고 있는 본래의 뜻과 어긋날 뿐더러 성소 수자 인권운동이 걸어온 역사성을 훼손하는 일” 이라며 “ 무분별한 용어 사용에 주의를 기울일 것을 촉구한다” 고 밝혔다.커밍아웃은 성소 수자가 자신의 성적지향이나 성별 정체성 등을 스스로 드러내는 것으로, 성 소수 자의 투쟁 방식 이자 결의를 담은 행동이다.국가 인권위원회와 한국기자협회는 2011년 제정한 인권보도 준칙 실천 매뉴얼에서 “ 커 밍 아웃은 성소 수자가 자신을 긍정하고 당당하게 성 정체성을 밝히는 의미이므로 범죄 사실을 고백하는 표현 등으로 사용하지 않도록 주의할 필요가 있다 ”며 성소 수자와 관련해 잘못된 용어 사용을 지양할 것을 권고했다."
""" 정부가 무조건적 규제가 아닌 현장 상황을 제대로 파악하고 이에 맞는 정책을 수립해야 한다는 목소리가 나온다.xa0"" "" 대형 마트를 방문한 10명 중 6명 꼴로 주변 음식점이나 상가에서 추가 소비를 해 낙수효과를 일으킨 것으로 분석됐다.xa0다만 아직 영업을 종료한 곳은 없다.전문가들은 소 상공인과 유통 대기업 간 객관적 논의를 통한 신중한 입법의 중요성을 강조했다.xa0xa0"" 대형 마트 문 닫자 매출 15% 줄었다"" "" 한국 유통학회가 올 1월 발표한 대형 유통시설이 주변 상권에 미치는 영향 보고서에 따르면 xa02018 년 이 마트 부 평점 등 6개 대형 마트 폐점 후 반경 3㎞ 이내 중소형 슈퍼마켓과 편의점, 음식점 등의 매출은 줄어들었다.xa0"
""" 유료 멤버십인 스마일클럽 회원에게는 최대 40만원까지 할인되는 20% 할인 쿠폰을 행사 기간에 총 3번 제공한다."" ""11 번 가도 연중 가장 큰 세일인 십일 절 페스티벌을 1일부터 11일까지 진행한다.유료회원인 슈퍼 세이브 회원에게는 구매 액의 5%, 일반 회원은 2% 가 월 최대 100만원 한도에서 적립된다."" ""이 베이 코리아는 1일부터 12일까지 G 마켓과 옥 션, G9에서 연중 최대 할인 행사인 빅 스마일 데이 행사를 한다."" 행사 기간 새로 스마일클럽에 가입하고 연회비 3만원을 내면 전액을 연계계좌로 돌려주는 사실상 무료 가입 행사도 한다."
미 국민이 지난 26일 무장 괴한들에 의해 납치된 지 닷새 만에 미 최정예 부대인 해군 특전단( 네이비 실) 요원들이 구출 작전을 개시하는 순간이었다.낙하산을 타고 착지한 특수요원들은 약 3 마일 (4.8 ㎞) 을 이동해 숲 속 납치범의 은신처를 급습했다.그러나 한 명은 어둠 속에서 탈출한 것으로 전해 졌다.월 턴은 나이 지리 아 국경에 접한 니제르의 마 사라 타 (Massalata) 의 농장에서 부인 및 딸과 함께 거주해 왔던 것으로 전해 졌다.이들 납치범은 월 턴의 몸값으로 약 100만 달러 (11 억 3천만 원 )를 요구한 것으로 전해 졌다.
