"미국이 끝까지 나이 지리아 후보 선출에 동의하지 않는다면 유 본부장 막판 역전 가능성도 점쳐 졌다.바이든 당선되면 역전 어려워져 , 유 본부장은 지난달 28일 진행한 WTO 사무총장 최종 선호도 조사에서 응 고지 오 콘 조 이웨 알라 나이 지리아 후보에 뒤졌다.중국과 무역 갈등을 빚고 있는 미국이 중국이 미는 나이 지리아 후보를 반대한다는 입장을 밝혔기 때문이다.대외정책에서 다 자주의를 중시하는 바이든 성 향상 중국 ·EU· 일본 등 다수 회원국 지지를 받는 나이 지리아 후보를 받아들이는 방향으로 입장을 바꿀 수 있기 때문이다.안 덕 근 서울대 국제대학원 국제학과 교수는 “ 상황은 지켜봐야 하겠지만, 전반적인 대세는 나이 지리아 후보 쪽으로 기운 것 같다” 고 분석했다. ,"
"김 전 회장은 이종 필 전 라 임 부사장 (42· 수감 중) 과 저녁식사를 한 뒤 룸살롱 작은 방 안으로 이동해 회의를 했다고검찰은 서울 남부 구치소에 수감 중인 김 전 회장을 4일 서울 남부 지검으로 불러 A 변호사와 검사들을 룸살롱에서 접대한 구체적인 날짜 등을 조사했다.동아 일보 취재를 종합하면 서울 남부 지검 형사 6부( 부장검사 김 락 현) 는 “ 김 전 회장이 지난해 7월 무렵부터 서울 강남구 청담동에 있는 F 룸살롱에 방 2, 3 개씩을 잡아 두고 대책 회의를 했다” 는 사건 관련자들의 진술을 확보했다.룸살롱 마담 B 씨는 올 4월 검찰에서 “ 김 전 회장이 지난해 6, 7월부터 는 이전과는 달리 방을 2, 3 개씩 ( 많이) 잡았다 ”며 “ 어떤 방엔 아가씨가 들어갔고, 어떤 방엔 안 들어갔다.김 전 회장은 두 방을 오가면서 이야기를 나눴다” 고 진술했다."
"해석되는 트윗을 연이어 게시하고 있다."" 누 욕 타임스 (NYT) 개 표 현황 지도에 따르면 한국 시간으로 5일 오전 9시 3분 기준 바이든 후보는 선거인단 253명을 확보, 당선에 필요한 매직 넘버 270명까지 17명이 남았다.바이 든 후보는 선거인단 6명이 걸린 네바다 주( 개 표 85% 완료 )에서도 앞서고 있다.서울= 뉴 시스 남빛나라 기자 = 4일( 현지시간) 도 널드 트럼프 미국 대통령이 트위터에서 성급하게 주요 지역 대선 승리를 주장했다가 또 경고 조치를 받았다.투표 용지 폐기 의혹을 주장한 게시물은 아예 가림 처리됐다."
"가 천대 길병원 소아 심장과 안 경진 교수는 외래 환자로 만난 아 난 드의 사정을 길병원 사회사업 실에 전달했고, 길병원은 국내의 후원기관들과 접촉해 아난드를 도울 방법을 찾았다.다행히 밀알 심장재단과 한국 심장재단, 그리고 익명의 신혼부부가 보내온 기부금까지 더 해져 아 난 드의 수술이 결정됐다.6일 가 천대 길병원에 따르면 지난 5월 한국에서 일을 하던 몽 골인 부부 사이에서 태어난 아 난 드는 ‘ 심실 중 격 결손’, ‘ 심 방중 격 결손’ 이라는 병을 갖고 있었다.밀 일 심장재단에서는 ‘ 참 필 하모닉 오케스트라’ 와 아난드를 돕기 위한 기금마련 음악회를 개최하기로 했다.아 난 드는 수술 경과가 좋아 심부전 약물치료도 중단했다."
"손 씨는“ 의대 입시 준비에, 의사 면허증 시험 준비로 동생을 제대로 돌봐 준 적이 없다 ”며 “ 전문 의가 된 뒤에도 일이 바빠서 동생 은커녕 가족조차 돌볼 시간이 없었다.사고가 발생한 지 5일이 지 나도 호텔 측에서 연락이 오지 않자 손 씨는 지난 4일 청와대 국민 청원에 글을 올렸다.손 씨는 사고의 1차 책임은 호텔 측에 있다고그런 저 대신 아빠처럼 제 자식을 돌봐 주던 착한 동생이 뇌사 상태에 빠졌습니다.손 씨 동생 (39) 은 지난달 30일 오후 3시 10분 쯤 부산 해운대구에 위치한 한 특급 호텔에서 현수막 설치 작업을 하던 중 리프트가 통째로 넘어지는 바람에 6m 높이에서 떨어지는 사고를 당했다."
"경고는 신문윤리 위 제재 가운데 가장 높은 수위다.신문윤리 위는 지적했다."" 신문윤리 위는 “ 최소한의 사실관계조차 확인하지 않고 사망 기사를 내보낸 것은 기사 기본 요건을 충족하지 못한 것” 이라며 “ 정확하고 공정하게 보도해야 할 언론 책임을 방기했다” 고 비판했다.제재 사유는 사실을 정확하게 전달해야 한다는 내용의 신문윤리 강령 및 신문윤리실천 요강 등 위반이다."" 이번 제재를 받은 매체들은 지난 9월 21일 BJ 아지 땅의 사망 소식을 일제히 보도했다."
"조지아의 선거인단은 16명으로, 이 곳에서 역전할 경우 바이든 후보 승리의 마지막 퍼즐이 완성된다.뉴욕 타임스 (NYT )에 따르면 5일( 현지시간) 미 동부시간 기준 오후 9시 40분( 한국시간 6일 오전 11시 40분) 현재 98% 개 표 수준에서 두 후보의 득표율은 각 49.4% 로 동률을 기록하고 있다.표 차가 1902 표에 불과 하다. 바이 든 후보는 뒤늦게 개표된 우편투표에서 트럼프 대통령을 빠르게 추격했다.이 시각 득표율은 각 2% 포인트, 1% 포인트, 그리고 동률로 좁혀 졌다.이에 따라 바이든 후보가 역전할 지 여부에 관심이 쏠린다."
"그러나 소 셜 미디어에서는 위스콘신이 설명할 수 없는 엄청난 투표율 상승을 의심하며 거짓 정보가 흘러나오고 있다는 것이다.페이스 북 등 소 셜 미디어를 통해 확산되고 있는데 도 널드 트럼프 대통령의 아들까지 이 주장을 옹호하고 나서 논란이 되고 있다.이번 대선에서도 개표 초반에는 그가 바이든 후보를 두 자릿수 포인트로 앞서 나갔지만 우편 투표함이 열리면서 전세는 역전됐다.한 트위터 이용자는 "" 주 내에서 투표하기 위해 등록된 사람은 겨우 312만 9,000명에 불과 하다"" 면서 "" 투표자 수는 그 이상"" 이라는 의혹을 제기했다.위스 콘 신 선거관리 위원회에 따르면 이날 현재 투표자 수는 역대 최다 인 330만명에 육박하며, 지난 1일 등록된 유권자 수는 368만 4,726명이다."
이 사고로 승용차 운전자가 다쳐 인근 병원에서 치료를 받고 있다.사고 수습 과정에서 일부 구간 지· 정체가 발생하기도 했다.경찰은 정확한 사고 경위를 조사하고 있다.( 대전= 연합 뉴스) 이 재림 기자 = 6일 오전 8시 28분께 대전 대덕구 경부 고속도로 서울 방향 회 덕분 기점 인근에서 승용차가 화물차와 콘크리트 중앙 분리대 사이 틈에 끼는 사고가 발생했다.walden@yna .co .kr
"김 재판장은 법원을 나설 때 동료 판사와 김 지사 재판의 핵심 쟁점인 닭 갈비 문제를 논의하는 모습이 기자에게 포착된 적도 있다.서울 고법의 한 부장판사는 "" 함상 훈 부장이 김 지사 재판으로 상당한 스트레스와 압박을 받은 듯하다"" 고 말했다. ,"" 킹크 랩 시연회 봤다"" 발언 뒤 재판부 합류 , 함 재판장은 지난 3월 차 문호 (52) 서울 고법 부장판사의 후임 재판장으로 김 지사의 사건을 맡았다.함 재판장은 3월부터 재판을 맡아 "" 이 사건 전체를 다시 보겠다 ""며 9월 3일 결심까지 6개월 간 김 지사 재판을 추가 심리했다.행정처 이력 없어, 특정 연구회 활동도 안 한 듯 , 함 부장판사는 우리 법 연구회나 국 제인 권법 연구회, 민사 판례 연구회 등 정치권의 주목을 받은 법원 내 학회 활동을 한 이력은 없다."
"( 익산= 연합 뉴스) 정 경재 나 보배 기자 = 전 북 익산의 한 아파트에서 가족 3명이 숨진 채 발견돼 경찰이 수사에 나섰다.발견 당시 A 씨를 제외한 나머지 가족은 모두 숨진 상태였던 것으로 알려 졌다.A 씨는 119에 의해 인근 병원으로 옮겨 져 치료 받고 있으나 상처가 깊어 위중한 것으로 전해 졌다.6일 익산경찰서 등에 따르면 이날 오후 5시 30분께 익산시 모현동의 한 아파트에서 A(43) 씨와 그의 아내 (43), 중학생 아들 (14), 초등학생 딸 (10) 등 4명이 쓰러져 있는 것을 경찰이 발견했다.이 들 몸에는 외상과 출혈이 있었으며, 현장에서는 흉기가 발견됐다 고 경찰은 설명했다."
( 용 인= 뉴스 1) 유재 규 기자 = 경기지역 소재 대학 캠퍼스에서 전동 킥 보드를 타다 쓰러진 재학생이 2 주째 혼수상태다.6일 경기 용인 동부 경찰서에 따르면 지난달 24일 오후 6시 15분께 용인시 처인구 소재 명지대 자연 캠퍼스에 재학 중인 A 씨 (24) 가 교내 한 도로에 쓰러져 있다는 신고가 접수됐다.A 씨는 해당 교내에 마련된 시외버스 차 고지로 들어가는 버스 운전기사에 의해 발견됐다.A 씨는 병원으로 이송돼 치료를 받고 있지만 여전히 깨어나지 못하고 있다.그의 가족과 주변인들을 통해 A 씨가 평소 지병이 있었는 지에 대한 언급은 없었다고
"블랙 핑크가 두꺼운 화장을 하고 장갑을 착용하지 않은 채로 중국의 국보인 판다와 접촉했다는 이유에서 다."" "" 지난 4일 블랙 핑크는 유 튜브에 24/365 with BLACKPINK 라는 제목의 웹 예능 예고 영상을 공개했다.펑몐신문은 "" 블랙 핑크는 화장을 한 채 올해 7월 20일 한국에서 태어난 판다 푸바오를 만졌으며, 어른 판다를 만질 때에도 장갑과 마스크를 착용하지 않았다 ""며 "" 이것은 판다를 감염시킬 우려가 높다."" 이 주제는 지난 5일 블랙 핑크, 장갑 미 착용 상태로 판다 접촉이라는 해 쉬 태그(#) 가 확산되면서 중국 SNS 인 웨이보와 현지 포털사이트 바이 두 등에서 큰 이목을 끌었다.지난달 방탄 소년단의 리더 RM이 미국 비영리재단 코리아 소사이 어 티가 주최한 밴 플리트 시상식 당시 전한 소감이 중국 언론의 융단 폭격을 맞기도 했다.이와 관련해 미국 워싱턴 포스트 (WP) 는 ""BTS 의 수상 소감을 놓고 중국 선전 매체들이 기사를 쏟아 내는 것은 한국의 영향력을 억제하고 정치적 위상을 높이려는 의도"" 라며 ""BTS 의 팬층이 두꺼워 공격 자체가 큰 실수였다"" 고 논평한 바 있다."
""" 미국의 대형 방송사들이 트럼프의 오늘 기자 회견을 중계하다가 허위 주장이라면서 방송을 중간에 끊어 버린 겁니다.◀ 리포트 ▶ 트럼프 대통령이 부정투표 의혹을 제기하기 위해 연 기자회견. 5분 여가 지나자 ABC와 NBC, CBS 등 미국의 주요 방송사들이 백악관 중계를 멈춰 버립니다.레스터 홀트 /NBC 앵커 "" 대통령이 다수의 허위 주장을 발언하고 있으므로 여기서 멈추겠습니다."" 데이 비드 뮤 리 /ABC 앵커 "" 다수의 허위사실, 근거 없는 주장을 말하며 당파적인 발언이 아니라고 주장하고 있습니다."" 미국 시간으로 저녁 6시 30분, 메인 뉴스가 진행되는 시간이었는데, 대통령의 중계는 끊지 않는다는 관례를 깨 버린 겁니다."
"베타카로틴의 혈 중 농도가 낮을수록 자궁 경부 암 및 자궁 경부 상피 내 암 등의 빈도가 높아 진다는 보고도 있다.코로나 19와 독감이 기승을 부리는 겨울에 접어들면서 폐 건강에 대한 관심이 높아 지고 있다.채소와 과일은 몸에 좋은 영양소가 많지만, 세계 각국의 의학 검증기관들은 고구마, 당근, 호박 등이 폐를 강하게 만든다고 했다.비타민 A의 이전 물질인 베타카로틴 (beta-carotene) 때문이다.베타카로틴은 폐 주위의 염증을 예방하고 면역력을 높여 암으로 발전하는 것을 막는데 도움을 준다."
CNN 홈페이지에 따르면 조지아는 트럼프 대통령과 바이든 후보가 49.4% 의 동률을 기록할 정도로 초 박빙 승부를 벌이고 있는 핵심 경 합주다.애리 조나( 선거인단 11명) 의 경우 미언론 가운데 일부는 바이든 후보의 승리지역으로 분류하고 있으나 나머지 언론들은 결론을 유보하고 있다.바이 든 후보는 초접전 경합지역인 조지 아주( 州 )에서 트럼프 대통령을 917 표 차이로 따돌리며 역전했다고여론조사업체 에디슨 리서치도 이 같은 역전 상황을 전했다.16명의 선거인단이 걸려 있는 조지 아주는 개표 초반만 해도 트럼프 대통령이 10% 포인트 안팎의 우위를 유지했지만 뒤늦게 개표가 시작된 우편투표가 바이든 후보에게 대거 쏠리면서 트럼프 대통령을 맹추격해 왔다.
"서울 고법 형사 2부( 부장판사 함상 훈 김 민 기 하 태한) 는 6일 김 지사에게 업무 방해 혐의에 대해 징역 2년을 선고했다.공직 선거법 위반 혐의에 대해서는 1 심 유죄를 뒤집고 무죄를 선고했다.재판부는 "" 선거운동은 특정선거에 특정 후보자가 있어야 하는데, 공소사실은 지방선거에서 더불어 민주당 소속 후보자가 당선될 수 있게끔 하게 한다는 내용"" 이라며 "" 선거는 특정돼 있는데 후보자는 특정이 안 됐다"" 고 지적했다.주장하는 것"" 이라며 "" 그것은 너무나 넓게 해석하는 것으로 보여, 죄형 법정주의에서 파생한 명확성 원칙에 벗어난 주장"" 이라고 설명했다."" 그러나 재판부는 김 지사가 2016년 11월 9일 드루 킹 일 당의 산채에서 한 댓 글 조작 프로그램 킹크 랩의 시연회를 본 것이 합리적 의심 없이 증명됐다고"
"현지 언론에 따르면 이 지역에서 특산물인 귤을 전문적으로 재배하는 인원은 약 100명에 불과 하다. 장인이 한 땀 한 땀 바느질로 수공예품을 만들 듯, 제한된 귤 전문가들이 한 해 농사를 모두 책임진다.귤 한 개 당 약 11만 원에 달하는 셈이다.이어 “에 히 메 현의 귤이 고가에 낙찰된 것은 이번이 처음은 아니다.다만 코로나 19 팬데믹에도 불구하고 예년처럼 100만 엔이 넘는 가격에 팔렸다는 것은 매우 놀라운 사실” 이라고 덧붙였다.서울신문 나우 뉴스 일본에서 귤 한 상자가 무려 1000만 원이 넘는 고가에 낙찰돼 눈길을 사로잡았다."
"디트로이트도 굉장히 선거의 진실성과 관련해서는 그동안 그리 좋은 모습을 보이지 않은 그런 곳 중 하나로 꼽힙니다.우편투표가 큰 참사로 이어질 것이다, 이런 얘기를 제가 많이 해 왔죠.여러 지역에서요. 여러 지역에서 역사적인 투표 수로 이겼습니다.그리고 워싱턴 포스트는 바이든 이 한때 17% 포인트로 앞서고 있다고그래서 실제 팩트를 억누르는 이런 폴이라고 서 프레스하는, 억누르는 여론조사라는 이런 얘기들이 많이 나오고 있습니다."
"미시간· 위스 콘 신이 전통적 민주당 텃밭인 반면, 애리 조나는 ‘ 신( 神) 과 총의 주’ 로 불릴 만큼 보수적인 공화당 텃밭이다.이 이변은 애리 조나에서 6 선( 選) 상원의원을 지내고 2008년 대선에 공화당 후보로 출마했던 거물 고( 故) 존 매케 인 의원을 빼곤 설명되지 않는다.바이든 과도 의정 생활을 함께 하며 우정을 나눴다.트럼프는 그를 “ 해군사관학교를 간신히 졸업한 멍청이” “ 베트남 포로로 잡혔던 패배자 ”라고 했다.트럼프는 2018 년 뇌종양을 앓던 매케 인이 오 바 마 케어( 전 국민 건강보험) 폐지에 반대하자 “ 어차피 죽을 사람” 이라는 막말을 했고, 매케 인 장례식에도 가지 않았다."
"( 청주= 연합 뉴스) 윤우 용 기자 = 신종 코로나 바 이러스 감염증( 코로나 19) 확 진자가 나온 LG 화학 청주 오 창공장 직원 A 씨는 6일 새벽 몇 번이나 잠에서 깼다.디스플레이 소재 생산라인에서 근무하던 50대 확 진자 B 씨와 공장 안에서 동선이 겹친 99명을 포함해 141명이 전날 코로나 19 검체 검사를 받아서 다. A 씨는 통근버스와 식당 등 직원들이 공동으로 이용하는 시설을 관리하고 방역을 담당하는 부서의 중간 간부다.전 직원 마스크 착용, 발열 체크 등 코로나 19 방 역 매뉴얼을 철저히 지켜 왔다고2004년 4월 문을 연 오 창공장( 생산시설 9개 동 )에서는 4천 800 여 명의 직원이 2 차 전지와 디스플레이 소재인 편광판을 생산한다.""A 씨는 6일 아침 141명 모두 음성 판정을 받았다는 소식을 전해 듣고 나서야 안도의 한숨을 깊게 내쉬었다."
"코로나 19가 1년 가까이 지속되면서 서울의 주요 상권들에는 임대 딱지가 붙은 빈 건물이 눈에 띄게 늘고 있다.나무 그늘 카페는 5년 동안 추억을 쌓아 온 골목에서 밀려나듯 나왔다."" 해 빗 투 게 더는 시민건물주가 돼 마을이라는 공동체를 재건 해보려 한다."" 보통의 임대 방식은 임대료를 지불한 만큼 "" 내 땅이다"" 라며 운영권을 주장하고 공간 별로 문을 걸어 잠근다.해 빗 투 게 더는 지역 기반의 식당· 문화시설· 기업이 왁자지껄 하게 토론하고 협업하는 방식을 목표하고 있다."
"그에게 한국의 첫 기억은 깨끗한 인천 공항이었다.‘그래, 이제부터 시작하면 되지. 이렇게 일감을 따오면 돼.’ 그가 처음 가서 매달린 곳은 남북하나 재단이었다.” 칠전 팔기란 말은 그에게 사치였다.그래도 그는 포기하지 않았다.그러다 일감을 따오면 며칠 동안 싱글벙글 얼굴이 환하게 다닙니다."
"미국 대선에서 조 바이든 미국 민주당 후보가 우세를 보이는 가운데 도 널드 트럼프 미국 대통령의 변화에 관심이 모이고 있다.이어 몇 분 후 "" 우리가 크게 이기고 있다 ""며 "" 우리는 절대 그들이 ( 선거를 훔치도록) 놔두지 않을 것이다.이 발언은 바이든 후보가 모든 우편투표가 개표될 때까지 기다릴 것이라고 발언한 직후 나왔다.트럼프 대통령은 앞서 선거일 이후 도착한 우편투표 용지까지 개표에 합산할 경우 소송을 하겠다고4일 오전 2시 20분, . 트럼프 대통령은 백악관에서 지지자들에게 "" 우리는 모든( 우 편) 투표가 중단되길 바란다."
"94% 개 표가 진행된 상황에서 트럼프 대통령 49.6%, 바이든 후보 49.2% 로 격차는 불과 0.4%P 입니다.이르면 오늘 (6 일) 펜실 베이니 아주 개표 결과에 따라 최종 승자가 가려 질 수도 있습니다.트럼프 대통령은 선거가 조작되고 있다며 불복 가능성을 거듭 시사했습니다.먼저 워싱턴 연결해 자세한 개표 상황부터 알아보겠습니다.바이 든 후보가 승부를 판가름할 수 있는 북부 경 합주 펜실 베이니 아 와 남부 조지아 주에서 트럼프 대통령을 맹추격하면서 상황이 다소 급박하게 흐르고 있는 것 같습니다."
"미국 대선 결과가 아직 나오지 않은 가운데 도 널드 트럼프 대통령이 ‘2 기 내각’ 출범을 준비하고 있다는 보도가 나왔다.트럼프 대통령은 우선 다음 주부터 크리 스토퍼 레이 미 연방수사 국 (FBI) 국장과 마크 에스 퍼 국방장관을 비롯해서 몇몇 각료들과 백악관 보좌진을 교체하는 안을 검토 중이다.한 편 주요 매체에 따르면 바이든 후보는 선거인단 253~264 명을, 트럼프 대통령은 213명을 확보한 것으로 집계됐다.바이 든 후보는 앞서고 있는 네바다 주( 선거인단 6명) 나 맹추격 중인 펜실 베이니 아주( 선거인단 20명), 조지 아주( 선거인단 16명) 중 한 곳만 승리해도 매직 넘버 270명을 확보하게 된다.사실상 연임 절차를 밟는 것이어서 소송과 함께 공식적인 불복 움직임으로 해석된다."
"매우 희귀한 호랑이 모습에 ‘ 길조’( 吉兆· 좋은 일이 있을 조짐) 라는 주장이 나오기도 한다.최근 사이언스 타임즈, 영국 메트로 등 외신에 따르면 지난 10월 19일 중국 저장성의 한 동물원에서 ‘ 골든 타이거’ (Golden Tiger) 네 쌍둥이가 태어났다.금빛 털을 가진 호랑이는 전 세계를 통틀어 단 30마리에 불과한 것으로 전해 졌다.금빛 털을 가진 호랑이는 인도와 네 팔 등지에서 서식하는 벵 골 호랑이의 돌연변이로 알려 졌다.6일( 현지시간) 영국 일간 메트로 등에 따르면 아마추어 사진작가인 수 멘 바지 파에 (27) 은 인도 오리 사주 동부에서 새와 원숭이를 관찰하던 중 검은 호랑이를 발견해 모습을 카메라에 담았다."
"( 서울= 연합 뉴스) 김 대호 기자 = 전 세계적으로 인도의 정글에만 7~8 마리 사는 것으로 추정되는 매우 희귀한 검은 호랑이가 카메라에 포착됐다.몸집도 일반 벵 갈 호랑이보다 조금 작고 사람 눈에도 잘 띄지 않는다.검은 호랑이가 포착된 것은 과거 1990년과 2007년에 이어 이번이 세 번째다.벵 갈 호랑이의 일종으로 유전적 변이로 인해 검은색 색소가 특히 많은 이 호랑이는 검은색의 줄무늬가 촘촘 하고 넓어 일반 호랑이의 오렌지색 털이 잘 보이지 않는다.그는 "" 과거 야생과 동물원에서 봤던 호랑이들과 는 완전히 달랐다 ""며 "" 불과 몇 초간이었지만 검은 호랑이를 볼 수 있어 매우 행운이었다"" 고 말했다."
"북 아일랜드 특사로 재임 중인 그는 아일랜드 싱크 탱크 국제 유럽 문제 연구소가 주최한 웨비나( 웹+ 세미나 )에서 이같이 전망했다고멀 베이니는 트럼프 대통령이 패배를 싫어한다며 2024년에 재도전한다고 하더라도 조 바이든 미국 민주당 대선후보보다 젊을 것이라고 말했다.그는 "" 나는 트럼프 대통령이 틀림없이 정치에 관여를 계속해 2024년 대선후보 명단에 오를 것으로 본다"" 면서 "" 트럼프 대통령은 매우 에너지가 넘치는 74 세로, 이번 선거에서 진다면 2024년이나 2028년에 계속하고 있을 것"" 이라고 말했다.멀 베이니는 트럼프 대통령이 대선 개표가 진행 중인 상황에서 펼치고 있는 무더기 소송 전이 민주주의 과정에 대한 위협이라는 지적에 대해서는 부인했다.그는 "" 그때까지 진짜 너절하고, 어지럽게 일이 진행될 수 있느냐"
"운동은 심장과 장 기능을 향상시키고 행복 호르몬을 분비시켜 스트레스를 해소하는데 도움이 된다.운동은 신체에 여러 가지 좋은 효과를 미친다."" 1. 달달 한 음식이 당긴다 운동을 하고 나면 바로 음식을 먹고 싶어 질 것 같지만 연구 결과는 이와는 다르다.30명의 젊은이들을 대상으로 한 연구에 따르면, 운동을 꾸준히 하면 운동 직후 음식에 대한 관심이 거의 없어 진다.단 음식에 대한 식탐이 계속되고 하루 종일 당분이 많이 든 간식거리를 찾는다면 몸매뿐만 아니라 건강도 망치기 쉽다."
"( 런던= 연합 뉴스) 박대한 특파원 = 한국 19세 청소년의 평균 키가 남녀 모두 세계 60 위권으로 조사됐다.35년 전만 해도 세계 130 위권 수준이었으나 전 세계에서 중국과 함께 가장 큰 개선을 이룬 것으로 나타났다.가장 키가 큰 나라와 작은 나라의 평균은 20cm 의 격차를 보였다.한국 19세 청소년의 평균 키는 남자는 68위, 여자는 60위였다.보고서는 중국과 한국이 지난 35년 간 평균 키에 있어서 가장 큰 개선을 보였다고"
"미국 언론이 4일( 현지시간) 보도했다.바이 든 후보는 역사상 처음으로 7000만 표 (5 일 오전 4시 기준 ·7211만 표 )를 돌파한 대선후보가 됐다.‘4 년 더 트럼프가 미국을 이끌도록 할 것이냐’를 묻는 식으로 선거운동이 전개됐고, ‘ 노 ’라고 외친 미국인들이 바이든 후보에게 역대 최다 표를 안겼다는 것이다.상식 밖 통치는 지지자들을 열광하게 했지만, 그만큼 공고한 ‘ 안 티 트럼프 ’를 만들었다."
” 아시아나 항공 (020560) 주식에 투자한 소액주주들은 요즘 인터넷 투자자 게시판 등에서 이렇게 자조한다.특히 이들은 아시아나 항공의 최대 주주를 포함한 모든 주주의 주식을 똑같은 비율로 줄이겠다는 채권단 방침에 뿔이 난 분위기다.이 데일리 박종 오 기자 “ 여기가 감자탕 맛 집 맞나요?설마 설마 했던 감자( 減資) 가 현실이 됐기 때문이다.
"그런데 왜 그때 못하고 왜 지금 와서 대통령이 되면 하겠다고11월 3일( 현지시간) 실시된 선거에서 최종 승자는 이틀이 지난 5일 오후에도 아직 확정되지 않았다."" 고 집요하게 따져 묻자 이렇게 답했다.오 바 마 정부 임기 마지막 해인 2016년 2월 연방 대법관 임명에 실패한 것이 대표적인 사례 중 하나다.상원 다수당이 공화당이 되면 대법관 증원 뿐 아니라 다른 식의 해법을 찾으려는 노력도 현실화 되기 힘들다."
